question,options,correctAnswer,explanation
"What does 'Bull Market' represent?","[""A market condition where prices are falling"",""A market condition where prices are rising"",""A market with high volatility"",""A market with no trading activity""]",1,"A Bull Market represents a market condition where stock prices are rising or expected to rise."
"What is a 'Blue Chip' stock?","[""A high-risk, high-reward stock"",""A stock from technology companies"",""A well-established company with stable earnings"",""A recently listed company""]",2,"Blue Chip stocks are from well-established companies known for their reliability, quality, and ability to operate profitably in good and bad times."
"What does 'P/E Ratio' stand for in stock valuation?","[""Profit/Earnings Ratio"",""Price/Earnings Ratio"",""Potential/Equity Ratio"",""Performance/Efficiency Ratio""]",1,"P/E Ratio stands for Price-to-Earnings Ratio, a valuation ratio of a company's current share price compared to its per-share earnings."
"What is a 'Market Order'?","[""An order to buy or sell a stock at the best available current price"",""An order to buy or sell a stock when it reaches a specific price"",""An order that must be executed at the closing of the market"",""An order valid for a specific time period""]",0,"A Market Order is an instruction to buy or sell a stock immediately at the best available current price."
"What does 'IPO' stand for?","[""International Portfolio Optimization"",""Investment Protection Option"",""Initial Public Offering"",""Integrated Profit Outlook""]",2,"IPO stands for Initial Public Offering - the process when a private company offers shares to the public for the first time."
